<?xml version="1.0" encoding="UTF-8"?>
<!-- edited with XML Spy v4.2 U (http://www.xmlspy.com) by Ponder (Vienna University of Technology) -->
<furniture xmlns="http://www.expersite.com/AEKI" xmlns:xsi="http://www.w3.org/2001/XMLSchema-instance" xsi:schemaLocation="http://www.expersite.com/AEKI ../apps/aeki/data/aeki.xsd">
	<!-- Rahmen oben und unten, Faecher -->
	<component>
		<shape>
			<cube/>
		</shape>
		<dimension unit="mm">
			<width>312</width>
			<height>214</height>
			<depth>20</depth>
		</dimension>
		<connector name="links1" unit="mm">
			<x>0</x>
			<y>44</y>
			<z>10</z>
		</connector>
		<connector name="links2" unit="mm">
			<x>0</x>
			<y>101</y>
			<z>0</z>
		</connector>
		<connector name="links3" unit="mm">
			<x>0</x>
			<y>158</y>
			<z>10</z>
		</connector>
		<connector name="rechts1" unit="mm">
			<x>312</x>
			<y>44</y>
			<z>10</z>
		</connector>
		<connector name="rechts2" unit="mm">
			<x>312</x>
			<y>101</y>
			<z>0</z>
		</connector>
		<connector name="rechts3" unit="mm">
			<x>312</x>
			<y>158</y>
			<z>10</z>
		</connector>
		<instance name="fach-oben" tracker="3"/>
		<instance name="fach-unten" tracker="4"/>
		<instance name="rahmen-oben" tracker="5"/>
		<instance name="rahmen-unten" tracker="6"/>
	</component>
	<!-- Rahmen links und rechts -->
	<component>
		<shape>
			<cube/>
		</shape>
		<dimension unit="mm">
			<width>551</width>
			<height>220</height>
			<depth>20</depth>
		</dimension>
		<connector unit="mm" name="vorderseite1">
			<x>10</x>
			<y>50</y>
			<z>0</z>
		</connector>
		<connector unit="mm" name="vorderseite2">
			<x>541</x>
			<y>50</y>
			<z>0</z>
		</connector>
		<connector unit="mm" name="mitte1">
			<x>0</x>
			<y>107</y>
			<z>0</z>
		</connector>
		<connector unit="mm" name="mitte2">
			<x>551</x>
			<y>107</y>
			<z>0</z>
		</connector>
		<connector unit="mm" name="rueckseite1">
			<x>10</x>
			<y>164</y>
			<z>0</z>
		</connector>
		<connector unit="mm" name="rueckseite2">
			<x>541</x>
			<y>164</y>
			<z>0</z>
		</connector>
		<connector unit="mm" name="vorderseite-fach1">
			<x>175</x>
			<y>50</y>
			<z>0</z>
		</connector>
		<connector unit="mm" name="rueckseite-fach1">
			<x>175</x>
			<y>164</y>
			<z>0</z>
		</connector>
		<connector unit="mm" name="vorderseite-fach2">
			<x>375</x>
			<y>50</y>
			<z>0</z>
		</connector>
		<connector unit="mm" name="rueckseite-fach2">
			<x>375</x>
			<y>164</y>
			<z>0</z>
		</connector>
		<connector unit="mm" name="rueckwand1">
			<x>10</x>
			<y>220</y>
			<z>10</z>
		</connector>
		<connector unit="mm" name="rueckwand2">
			<x>541</x>
			<y>220</y>
			<z>10</z>
		</connector>
		<instance name="rahmen-links" tracker="7"/>
		<instance name="rahmen-rechts" tracker="8"/>
	</component>
	<!-- Rueckwand -->
	<component>
		<shape>
			<cube/>
		</shape>
		<dimension unit="mm">
			<width>352</width>
			<height>551</height>
			<depth>3</depth>
		</dimension>
		<connector unit="mm" name="links-oben">
			<x>10</x>
			<y>541</y>
			<z>0</z>
		</connector>
		<connector unit="mm" name="rechts-oben">
			<x>342</x>
			<y>541</y>
			<z>0</z>
		</connector>
		<connector unit="mm" name="links-unten">
			<x>10</x>
			<y>10</y>
			<z>0</z>
		</connector>
		<connector unit="mm" name="rechts-unten">
			<x>342</x>
			<y>10</y>
			<z>0</z>
		</connector>
		<instance name="rueckwand" tracker="9"/>
	</component>
	<!-- Bauanleitung -->
	<assembly>
		<add-component name="rahmen-unten"/>
		<rotate axis="xneg" angle="90"/>
		<add-component name="rahmen-links">
			<connect>
				<connector-ref name="vorderseite1"/>
				<connector-ref name="links1" componentRef="rahmen-unten"/>
			</connect>
			<connect>
				<connector-ref name="mitte1"/>
				<connector-ref name="links2" componentRef="rahmen-unten"/>
			</connect>
			<connect>
				<connector-ref name="rueckseite1"/>
				<connector-ref name="links3" componentRef="rahmen-unten"/>
			</connect>
		</add-component>
		<add-component name="rahmen-rechts">
			<connect>
				<connector-ref name="vorderseite2"/>
				<connector-ref name="rechts1" componentRef="rahmen-unten"/>
			</connect>
			<connect>
				<connector-ref name="mitte2"/>
				<connector-ref name="rechts2" componentRef="rahmen-unten"/>
			</connect>
			<connect>
				<connector-ref name="rueckseite2"/>
				<connector-ref name="rechts3" componentRef="rahmen-unten"/>
			</connect>
		</add-component>
		<add-component name="rahmen-oben">
			<connect>
				<connector-ref name="links1"/>
				<connector-ref name="vorderseite2" componentRef="rahmen-links"/>
			</connect>
			<connect>
				<connector-ref name="links3"/>
				<connector-ref name="rueckseite2" componentRef="rahmen-links"/>
			</connect>
			<connect>
				<connector-ref name="rechts1"/>
				<connector-ref name="vorderseite1" componentRef="rahmen-rechts"/>
			</connect>
			<connect>
				<connector-ref name="rechts3"/>
				<connector-ref name="rueckseite1" componentRef="rahmen-rechts"/>
			</connect>
		</add-component>
		<add-component name="rueckwand">
			<connect>
				<connector-ref name="rechts-unten"/>
				<connector-ref name="rueckwand1" componentRef="rahmen-links"/>
			</connect>
			<connect>
				<connector-ref name="rechts-oben"/>
				<connector-ref name="rueckwand2" componentRef="rahmen-links"/>
			</connect>
			<connect>
				<connector-ref name="links-unten"/>
				<connector-ref name="rueckwand2" componentRef="rahmen-rechts"/>
			</connect>
			<connect>
				<connector-ref name="links-oben"/>
				<connector-ref name="rueckwand1" componentRef="rahmen-rechts"/>
			</connect>
		</add-component>
		<rotate axis="xneg" angle="90"/>
		<add-component name="fach-unten">
			<connect>
				<connector-ref name="links1"/>
				<connector-ref name="vorderseite-fach2" componentRef="rahmen-links"/>
			</connect>
			<connect>
				<connector-ref name="links3"/>
				<connector-ref name="rueckseite-fach2" componentRef="rahmen-links"/>
			</connect>
			<connect>
				<connector-ref name="rechts1"/>
				<connector-ref name="vorderseite-fach1" componentRef="rahmen-rechts"/>
			</connect>
			<connect>
				<connector-ref name="rechts3"/>
				<connector-ref name="rueckseite-fach1" componentRef="rahmen-rechts"/>
			</connect>
		</add-component>
		<add-component name="fach-oben">
			<connect>
				<connector-ref name="links1"/>
				<connector-ref name="vorderseite-fach1" componentRef="rahmen-links"/>
			</connect>
			<connect>
				<connector-ref name="links3"/>
				<connector-ref name="rueckseite-fach1" componentRef="rahmen-links"/>
			</connect>
			<connect>
				<connector-ref name="rechts1"/>
				<connector-ref name="vorderseite-fach2" componentRef="rahmen-rechts"/>
			</connect>
			<connect>
				<connector-ref name="rechts3"/>
				<connector-ref name="rueckseite-fach2" componentRef="rahmen-rechts"/>
			</connect>
		</add-component>
		<rotate axis="xpos" angle="90"/>
	</assembly>
</furniture>
